key,Message,topic,val,words
53789589_so,keras python python-3.x tensorflow keras tensorflow importing error in sublime text and spyder but working in command line in command-line everything seems fine but when i am importing tensorflow in sublime text or spyder it gives the following error -      traceback most recent call last:    file /usr/local/lib/python3.6/dist-packages/tensorflow/python/pywrap_tensorflow.py line 58 in       from tensorflow.python.pywrap_tensorflow_internal import *    file /usr/local/lib/python3.6/dist-packages/tensorflow/python/pywrap_tensorflow_internal.py line 28 in       _pywrap_tensorflow_internal = swig_import_helper    file /usr/local/lib/python3.6/dist-packages/tensorflow/python/pywrap_tensorflow_internal.py line 24 in swig_import_helper      _mod = imp.load_module _pywrap_tensorflow_internal  fp pathname description    file /usr/lib/python3.6/imp.py line 243 in load_module      return load_dynamicname filename file    file /usr/lib/python3.6/imp.py line 343 in load_dynamic      return _loadspec  importerror libcublas.so.9.0 cannot open shared object file no such file or directory      during handling of the above exception another exception occurred      traceback most recent call last:    file /home/himanshu/desktop/iii.py line 1 in       import tensorflow as tf    file /usr/local/lib/python3.6/dist-packages/tensorflow/ init .py line 24 in       from tensorflow.python import pywrap_tensorflow  # pylint disable=unused-import    file /usr/local/lib/python3.6/dist-packages/tensorflow/python/ init .py line 49 in       from tensorflow.python import pywrap_tensorflow    file /usr/local/lib/python3.6/dist-packages/tensorflow/python/pywrap_tensorflow.py line 74 in       raise importerrormsg  importerror traceback most recent call last:    file /usr/local/lib/python3.6/dist-packages/tensorflow/python/pywrap_tensorflow.py line 58 in       from tensorflow.python.pywrap_tensorflow_internal import *    file /usr/local/lib/python3.6/dist-packages/tensorflow/python/pywrap_tensorflow_internal.py line 28 in       _pywrap_tensorflow_internal = swig_import_helper    file /usr/local/lib/python3.6/dist-packages/tensorflow/python/pywrap_tensorflow_internal.py line 24 in swig_import_helper      _mod = imp.load_module _pywrap_tensorflow_internal  fp pathname description    file /usr/lib/python3.6/imp.py line 243 in load_module      return load_dynamicname filename file    file /usr/lib/python3.6/imp.py line 343 in load_dynamic      return _loadspec  importerror libcublas.so.9.0 cannot open shared object file no such file or directory   when i am importing keras   following is the error     using tensorflow backend.  traceback most recent call last:    file /usr/local/lib/python3.6/dist-packages/tensorflow/python/pywrap_tensorflow.py line 58 in       from tensorflow.python.pywrap_tensorflow_internal import *    file /usr/local/lib/python3.6/dist-packages/tensorflow/python/pywrap_tensorflow_internal.py line 28 in       _pywrap_tensorflow_internal = swig_import_helper    file /usr/local/lib/python3.6/dist-packages/tensorflow/python/pywrap_tensorflow_internal.py line 24 in swig_import_helper      _mod = imp.load_module _pywrap_tensorflow_internal  fp pathname description    file /usr/lib/python3.6/imp.py line 243 in load_module      return load_dynamicname filename file    file /usr/lib/python3.6/imp.py line 343 in load_dynamic      return _loadspec  importerror libcublas.so.9.0 cannot open shared object file no such file or directory      during handling of the above exception another exception occurred      traceback most recent call last:    file /home/himanshu/desktop/iii.py line 1 in       import keras    file /usr/local/lib/python3.6/dist-packages/keras/ init .py line 3 in       from  import utils    file /usr/local/lib/python3.6/dist-packages/keras/utils/ init .py line 6 in       from  import conv_utils    file /usr/local/lib/python3.6/dist-packages/keras/utils/conv_utils.py line 9 in       from . import backend as k    file /usr/local/lib/python3.6/dist-packages/keras/backend/ init .py line 89 in       from .tensorflow_backend import *    file /usr/local/lib/python3.6/dist-packages/keras/backend/tensorflow_backend.py line 5 in       import tensorflow as tf    file /usr/local/lib/python3.6/dist-packages/tensorflow/ init .py line 24 in       from tensorflow.python import pywrap_tensorflow  # pylint disable=unused-import    file /usr/local/lib/python3.6/dist-packages/tensorflow/python/ init .py line 49 in       from tensorflow.python import pywrap_tensorflow    file /usr/local/lib/python3.6/dist-packages/tensorflow/python/pywrap_tensorflow.py line 74 in       raise importerrormsg  importerror traceback most recent call last:    file /usr/local/lib/python3.6/dist-packages/tensorflow/python/pywrap_tensorflow.py line 58 in       from tensorflow.python.pywrap_tensorflow_internal import *    file /usr/local/lib/python3.6/dist-packages/tensorflow/python/pywrap_tensorflow_internal.py line 28 in       _pywrap_tensorflow_internal = swig_import_helper    file /usr/local/lib/python3.6/dist-packages/tensorflow/python/pywrap_tensorflow_internal.py line 24 in swig_import_helper      _mod = imp.load_module _pywrap_tensorflow_internal  fp pathname description    file /usr/lib/python3.6/imp.py line 243 in load_module      return load_dynamicname filename file    file /usr/lib/python3.6/imp.py line 343 in load_dynamic      return _loadspec  importerror libcublas.so.9.0 cannot open shared object file no such file or directory      failed to load the native tensorflow runtime    note - i am using pip for my python packages and not conda ,6,0.991587372772214,"0.076*""tensorflow"" + 0.065*""python"" + 0.025*""file"" + 0.022*""version"" + 0.021*""error"" + 0.020*""py"" + 0.020*""install"" + 0.019*""instal"" + 0.017*""run"" + 0.016*""line"""
45777648_so,python tensorflow problems installing tensor flow windows 10 i m trying to get tensorflow to work on my windows 10 machine i have cude 8 and cudnn 5.1 installed and added to the  .installed python 3.5.4 then proceeded to install tensorflow by executing   the computer is running a geforce 1060  here is what i get when i try to import tensorflow     import tensorflow as tf  traceback most recent call last:   file c:\users\morit\appdata\local\programs\python\python35\lib\site->packages\tensorflow\python\pywrap_tensorflow_internal.py line 18 in >swig_import_helper     return importlib.import_modulemname   file >c:\users\morit\appdata\local\programs\python\python35\lib\importlib__init__.p>y line 126 in import_module     return _bootstrap._gcd_importname[level:] package level   file  line 985 in _gcd_import   file  line 968 in _find_and_load   file  line 957 in _find_and_load_unlocked   file  line 666 in _load_unlocked   file  line 577 in module_from_spec   file  line 938 in create_module   file  line 222 in _call_with_frames_removed  importerror dll load failed the specified module could not be found   during handling of the above exception another exception occurred below     traceback most recent call last:   file c:\users\morit\appdata\local\programs\python\python35\lib\site->packages\tensorflow\python\pywrap_tensorflow.py line 41 in      from tensorflow.python.pywrap_tensorflow_internal import *   file c:\users\morit\appdata\local\programs\python\python35\lib\site->packages\tensorflow\python\pywrap_tensorflow_internal.py line 21 in      _pywrap_tensorflow_internal = swig_import_helper   file c:\users\morit\appdata\local\programs\python\python35\lib\site->packages\tensorflow\python\pywrap_tensorflow_internal.py line 20 in >swig_import_helper     return importlib.import_module _pywrap_tensorflow_internal    file >c:\users\morit\appdata\local\programs\python\python35\lib\importlib__init__.p>y line 126 in import_module     return _bootstrap._gcd_importname[level:] package level  importerror no module named  _pywrap_tensorflow_internal    during handling of the above exception another exception occurred     traceback most recent call last:   file  line 1 in    file c:\users\morit\appdata\local\programs\python\python35\lib\site->packages\tensorflow__init__.py line 24 in      from tensorflow.python import *   file c:\users\morit\appdata\local\programs\python\python35\lib\site->packages\tensorflow\python__init__.py line 49 in      from tensorflow.python import pywrap_tensorflow   file c:\users\morit\appdata\local\programs\python\python35\lib\site->packages\tensorflow\python\pywrap_tensorflow.py line 52 in      raise importerrormsg  importerror traceback most recent call last:   file c:\users\morit\appdata\local\programs\python\python35\lib\site->packages\tensorflow\python\pywrap_tensorflow_internal.py line 18 in >swig_import_helper     return importlib.import_modulemname   file >c:\users\morit\appdata\local\programs\python\python35\lib\importlib__init__.p>y line 126 in import_module     return _bootstrap._gcd_importname[level:] package level   file  line 985 in _gcd_import   file  line 968 in _find_and_load   file  line 957 in _find_and_load_unlocked   file  line 666 in _load_unlocked   file  line 577 in module_from_spec   file  line 938 in create_module   file  line 222 in _call_with_frames_removed  importerror dll load failed the specified module could not be found   during handling of the above exception another exception occurred     traceback most recent call last:   file c:\users\morit\appdata\local\programs\python\python35\lib\site->packages\tensorflow\python\pywrap_tensorflow.py line 41 in      from tensorflow.python.pywrap_tensorflow_internal import *   file c:\users\morit\appdata\local\programs\python\python35\lib\site->packages\tensorflow\python\pywrap_tensorflow_internal.py line 21 in      _pywrap_tensorflow_internal = swig_import_helper   file c:\users\morit\appdata\local\programs\python\python35\lib\site->packages\tensorflow\python\pywrap_tensorflow_internal.py line 20 in >swig_import_helper     return importlib.import_module _pywrap_tensorflow_internal    file >c:\users\morit\appdata\local\programs\python\python35\lib\importlib__init__.p>y line 126 in import_module     return _bootstrap._gcd_importname[level:] package level  importerror no module named  _pywrap_tensorflow_internal       failed to load the native tensorflow runtime      see > https://www.tensorflow.org/install/install_sources#common_installation_problems       for some common reasons and solutions include the entire stack trace  above this error message when asking for help i ve faced this error during my setup  but my environment is windows 7.uninstalled the python and reinstalled python 3.5 and continued the setup.next followed this link to resolve the dll load failed error  https://www.tensorflow.org/versions/r0.12/get_started/os_setup#pip_installation_on_windows,6,0.9865279707833945,"0.076*""tensorflow"" + 0.065*""python"" + 0.025*""file"" + 0.022*""version"" + 0.021*""error"" + 0.020*""py"" + 0.020*""install"" + 0.019*""instal"" + 0.017*""run"" + 0.016*""line"""
46644117_so,tensorflow trensorflow installation issue failed to load the native tensorflow runtime i am trying to install tensorflow in a ubuntu machine running on oracle virtualbox within a windows pc  system details:host os windows7 - 32 bitvm oracle virtuaboxvm os ubuntu -  64 bit   steps followed for tensor flow installation 1 created a session tflow with conda and python 3.52 activated tflow3 installed tensorflow through pip4 tried to import tensorflow with the following command after installation: import tensorflow as tf   system threw the following error      import tensorflow as tf   traceback most recent call last     file /home/sethu/conda3/envs/tflow/lib/python3.5/site-packages/tensorflow/python/pywrap_tensorflow.py line 41 in        from tensorflow.python.pywrap_tensorflow_internal import *     file /home/sethu/conda3/envs/tflow/lib/python3.5/site-packages/tensorflow/python/pywrap_tensorflow_internal.py line 28 in        _pywrap_tensorflow_internal = swig_import_helper     file /home/sethu/conda3/envs/tflow/lib/python3.5/site-packages/tensorflow/python/pywrap_tensorflow_internal.py line 24 in swig_import_helper       _mod = imp.load_module _pywrap_tensorflow_internal  fp pathname description     file /home/sethu/conda3/envs/tflow/lib/python3.5/imp.py line 243 in load_module       return load_dynamicname filename file     file /home/sethu/conda3/envs/tflow/lib/python3.5/imp.py line 343 in load_dynamic       return _loadspec   importerror /lib/x86_64-linux-gnu/libc.so.6 version `glibc_2.17  not found required by /home/sethu/conda3/envs/tflow/lib/python3.5/site-packages/tensorflow/python/_pywrap_tensorflow_internal.so    during handling of the above exception another exception occurred      traceback most recent call last     file  line 1 in      file /home/sethu/conda3/envs/tflow/lib/python3.5/site-packages/tensorflow/ init .py line 24 in        from tensorflow.python import *     file /home/sethu/conda3/envs/tflow/lib/python3.5/site-packages/tensorflow/python/ init .py line 49 in        from tensorflow.python import pywrap_tensorflow     file /home/sethu/conda3/envs/tflow/lib/python3.5/site-packages/tensorflow/python/pywrap_tensorflow.py line 52 in        raise importerrormsg   importerror traceback most recent call last     file /home/sethu/conda3/envs/tflow/lib/python3.5/site-packages/tensorflow/python/pywrap_tensorflow.py line 41 in        from tensorflow.python.pywrap_tensorflow_internal import *     file /home/sethu/conda3/envs/tflow/lib/python3.5/site-packages/tensorflow/python/pywrap_tensorflow_internal.py line 28 in        _pywrap_tensorflow_internal = swig_import_helper     file /home/sethu/conda3/envs/tflow/lib/python3.5/site-packages/tensorflow/python/pywrap_tensorflow_internal.py line 24 in swig_import_helper       _mod = imp.load_module _pywrap_tensorflow_internal  fp pathname description     file /home/sethu/conda3/envs/tflow/lib/python3.5/imp.py line 243 in load_module       return load_dynamicname filename file     file /home/sethu/conda3/envs/tflow/lib/python3.5/imp.py line 343 in load_dynamic       return _loadspec   importerror /lib/x86_64-linux-gnu/libc.so.6 version `glibc_2.17  not found required by /home/sethu/conda3/envs/tflow/lib/python3.5/site-packages/tensorflow/python/_pywrap_tensorflow_internal.so        failed to load the native tensorflow runtime        see   https://www.tensorflow.org/install/install_sources#common_installation_problems       for some common reasons and solutions  include the entire stack trace  above this error message when asking for help   please help!  thankssethu may you use jupyter notebook?there is all file you required have been already install,6,0.986081884714081,"0.076*""tensorflow"" + 0.065*""python"" + 0.025*""file"" + 0.022*""version"" + 0.021*""error"" + 0.020*""py"" + 0.020*""install"" + 0.019*""instal"" + 0.017*""run"" + 0.016*""line"""
53542547_so,tensorflow import tensorflow is failing with importerror dll load failed the specified module could not be found python 3.6.7 v3.6.7:6ec5cf24b7 oct 20 2018 13:35:33 [msc v.1900 64 bit amd64] on win32type help copyright credits or license for more information                 import tensorflow      traceback most recent call last:        file c:\users\abhisek\appdata\local\programs\python\python36\lib\site-packages\tensorflow\python\pywrap_tensorflow.py line 58 in           from tensorflow.python.pywrap_tensorflow_internal import *        file c:\users\abhisek\appdata\local\programs\python\python36\lib\site-packages\tensorflow\python\pywrap_tensorflow_internal.py line 28 in           _pywrap_tensorflow_internal = swig_import_helper        file c:\users\abhisek\appdata\local\programs\python\python36\lib\site-packages\tensorflow\python\pywrap_tensorflow_internal.py line 24 in swig_import_helper          _mod = imp.load_module _pywrap_tensorflow_internal  fp pathname description        file c:\users\abhisek\appdata\local\programs\python\python36\lib\imp.py line 243 in load_module          return load_dynamicname filename file        file c:\users\abhisek\appdata\local\programs\python\python36\lib\imp.py line 343 in load_dynamic          return _loadspec      importerror dll load failed the specified module could not be found           during handling of the above exception another exception occurred  traceback most recent call last:  file  line 1 in     import tensorflow  file c:\users\abhisek\appdata\local\programs\python\python36\lib\site-packages\tensorflow__init__.py line 24 in     from tensorflow.python import pywrap_tensorflow  # pylint disable=unused-import  file c:\users\abhisek\appdata\local\programs\python\python36\lib\site-packages\tensorflow\python__init__.py line 49 in     from tensorflow.python import pywrap_tensorflow  file c:\users\abhisek\appdata\local\programs\python\python36\lib\site-packages\tensorflow\python\pywrap_tensorflow.py line 74 in     raise importerrormsgimporterror traceback most recent call last:  file c:\users\abhisek\appdata\local\programs\python\python36\lib\site-packages\tensorflow\python\pywrap_tensorflow.py line 58 in     from tensorflow.python.pywrap_tensorflow_internal import *  file c:\users\abhisek\appdata\local\programs\python\python36\lib\site-packages\tensorflow\python\pywrap_tensorflow_internal.py line 28 in     _pywrap_tensorflow_internal = swig_import_helper  file c:\users\abhisek\appdata\local\programs\python\python36\lib\site-packages\tensorflow\python\pywrap_tensorflow_internal.py line 24 in swig_import_helper    _mod = imp.load_module _pywrap_tensorflow_internal  fp pathname description  file c:\users\abhisek\appdata\local\programs\python\python36\lib\imp.py line 243 in load_module    return load_dynamicname filename file  file c:\users\abhisek\appdata\local\programs\python\python36\lib\imp.py line 343 in load_dynamic    return _loadspecimporterror dll load failed the specified module could not be found  failed to load the native tensorflow runtime  see  https://www.tensorflow.org/install/errors ,6,0.9853208710006094,"0.076*""tensorflow"" + 0.065*""python"" + 0.025*""file"" + 0.022*""version"" + 0.021*""error"" + 0.020*""py"" + 0.020*""install"" + 0.019*""instal"" + 0.017*""run"" + 0.016*""line"""
50338301_so,"python tensorflow import tensorflow as tf error help appreciated on following tensorflow installation issue system windows 10 home 64-bit  -clean installed python 3.6.5 as administrator  -ran pip install tensorflow from python s script directory via cmd-line as administrator no errors  trying to execute following code importing module   gives following stack trace      traceback most recent call last   file  c:\users\user\appdata\local\programs\python\python36\lib\site-packages\tensorflow\python\pywrap_tensorflow_internal.py,  line 14 in swig_import_helper      return importlib.import_modulemname   file c:\users\user\appdata\local\programs\python\python36\lib\importlib__init__.py,  line 126 in import_module      return _bootstrap._gcd_importname[level:] package level   file  line 994 in _gcd_import   file   line 971 in _find_and_load   file   line 955 in _find_and_load_unlocked   file  line 658 in _load_unlocked   file  line 571 in module_from_spec   file  line 922 in  create_module   file  line 219 in  _call_with_frames_removed importerror dll load failed a dynamic link library dll initialization routine failed      during handling of the above exception another exception occurred      traceback most recent call last   file  c:\users\user\appdata\local\programs\python\python36\lib\site-packages\tensorflow\python\pywrap_tensorflow.py,  line 58 in       from tensorflow.python.pywrap_tensorflow_internal import *   file c:\users\user\appdata\local\programs\python\python36\lib\site-packages\tensorflow\python\pywrap_tensorflow_internal.py,  line 17 in       _pywrap_tensorflow_internal = swig_import_helper   file c:\users\user\appdata\local\programs\python\python36\lib\site-packages\tensorflow\python\pywrap_tensorflow_internal.py,  line 16 in swig_import_helper      return importlib.import_module _pywrap_tensorflow_internal    file  c:\users\user\appdata\local\programs\python\python36\lib\importlib__init__.py,  line 126 in import_module      return _bootstrap._gcd_importname[level:] package level modulenotfounderror no module named  _pywrap_tensorflow_internal       during handling of the above exception another exception occurred      traceback most recent call last   file  line 1 in        import tensorflow as tf   file c:\users\user\appdata\local\programs\python\python36\lib\site-packages\tensorflow__init__.py,  line 24 in       from tensorflow.python import pywrap_tensorflow  # pylint disable=unused-import   file  c:\users\user\appdata\local\programs\python\python36\lib\site-packages\tensorflow\python__init__.py,  line 49 in       from tensorflow.python import pywrap_tensorflow   file c:\users\user\appdata\local\programs\python\python36\lib\site-packages\tensorflow\python\pywrap_tensorflow.py,  line 74 in       raise importerrormsg importerror traceback most recent call last   file  c:\users\user\appdata\local\programs\python\python36\lib\site-packages\tensorflow\python\pywrap_tensorflow_internal.py,  line 14 in swig_import_helper      return importlib.import_modulemname   file c:\users\user\appdata\local\programs\python\python36\lib\importlib__init__.py,  line 126 in import_module      return _bootstrap._gcd_importname[level:] package level   file  line 994 in _gcd_import   file   line 971 in _find_and_load   file   line 955 in _find_and_load_unlocked   file  line 658 in _load_unlocked   file  line 571 in module_from_spec   file  line 922 in  create_module   file  line 219 in  _call_with_frames_removed importerror dll load failed a dynamic link library dll initialization routine failed      during handling of the above exception another exception occurred      traceback most recent call last   file  c:\users\user\appdata\local\programs\python\python36\lib\site-packages\tensorflow\python\pywrap_tensorflow.py,  line 58 in       from tensorflow.python.pywrap_tensorflow_internal import *   file c:\users\user\appdata\local\programs\python\python36\lib\site-packages\tensorflow\python\pywrap_tensorflow_internal.py,  line 17 in       _pywrap_tensorflow_internal = swig_import_helper   file c:\users\user\appdata\local\programs\python\python36\lib\site-packages\tensorflow\python\pywrap_tensorflow_internal.py,  line 16 in swig_import_helper      return importlib.import_module _pywrap_tensorflow_internal    file  c:\users\user\appdata\local\programs\python\python36\lib\importlib__init__.py,  line 126 in import_module      return _bootstrap._gcd_importname[level:] package level modulenotfounderror no module named  _pywrap_tensorflow_internal       failed to load the native tensorflow runtime      see   https://www.tensorflow.org/install/install_sources#common_installation_problems       for some common reasons and solutions  include the entire stack trace  above this error message when asking for help   help appreciated!  ",6,0.9851443832102339,"0.076*""tensorflow"" + 0.065*""python"" + 0.025*""file"" + 0.022*""version"" + 0.021*""error"" + 0.020*""py"" + 0.020*""install"" + 0.019*""instal"" + 0.017*""run"" + 0.016*""line"""
