key,Message,topic,val,words
115294_kg,i think i have a good grasp of the basics of machine learning and looking for some good books that go further into machine learning topics like computer vision and natural language processing some of the books i ve seen recommended are over 10 years old and i m not sure if they re still worth reading now   i have a list of book and i m reading them check them.these books are not what you want but may help  book #1 - the hundred page machine learning book by andrej burkov   book #2 - python machine learning 2nd edition by sebastian reschka  book #3 - grokking deep learning by andrew trask  book #4 - probabilistic programming and bayesian methods for hackers by cameron davidson  book #5 - doing data science straight talk from the frontline by rachel schutt  book #6 - reinforcement learning by sutton and barto  book #7 - the book of why by judea pearl  book #9 - quantum machine learning by peter wittek   i started with r for machine learning so couple of resources with r as programming language but note that the theory provided in these texts is invaluable and guide you through structured thinking process on analysing data and fitting machine learning models    an introduction to statistical learning is a comprehensive book on learning the nuts and bolts of machine learning this is a free book available for download plenty of math context while not being too intimidating supporting code and exercises in r but the theory is still amazing to go for    applied predictive modeling by max kuhn creator of caret package for machine learning in r this book is a gem for case studies has solutions hosted online as well    for python i just started with hands-on machine learning with scikit-learn and tensorflow early days will let you know as time goes   o reily series might be helpful.....they are up to date   i tried to learn r once for a course and just could not wrap my head around it i stick to python now,22,0.933822573840364,"0.033*""learn"" + 0.027*""datum"" + 0.024*""machine"" + 0.019*""learning"" + 0.015*""data"" + 0.014*""good"" + 0.013*""https"" + 0.013*""python"" + 0.011*""science"" + 0.010*""start"""
44021702_so,"algorithm cluster-analysis cluster points by spheres in 3d space there is 3d space limited with a cube with edge=2000  the center of coordinate system is point 0 0 0 so the maximum/minimal coordinate value is 1000/-1000  there are 10000 points generated with discrete uniform distribution inside of k spheres located in the cube  radius r of each sphere is 250  centers of spheres are located at the distance of not less than 2*r  it is required to determine which point related to which sphere  input array of 10000 structures like   where number is unique id of the point x,y,z - it s coordinates  output   array of 10000 structures like   where cluster_id is unique cluster id of a sphere that point belongs to  initially i considered a following solution  1 find euclidian distance for each point from  center of coordinates 0;0;0 to point s coordinates  2 sort this array of distances in descending order  3 get the point from the sorted array of distances and put in a new set of cluster maximals  4 compare following point from the array to each value from the set of cluster maximals initially 1 value  if it s euclidian distance less than or equal to 2*r then  mark this point as belonging to kth cluster range=1..n otherwise add the point to the set of cluster maximals  5 repeat step 4  two concerns i have  1 there is an issue that my algorithm would work only in case if claster maximals are located on the surface of the spheres  2 plus according to the task requirements there could be the case when 2 spheres can have 1 and only common point  i think in case if point belongs to 2 spheres it is ok to mark it with cluster_id of any of these 2 shperes  could you please provide a proper solution to the task as the radius is given find the point with the most neighbors  take the average of its neighbors as center and remove everything within the radius  repeat until no dense points remain  perform some postprocessing to further optimize for unassigned points and to ensure the minimum distance",23,0.9335553404922246,"0.077*""cluster"" + 0.027*""point"" + 0.021*""distance"" + 0.020*""datum"" + 0.019*""matrix"" + 0.018*""algorithm"" + 0.013*""pca"" + 0.013*""analysis"" + 0.011*""number"" + 0.011*""vector"""
53260323_so,"apache-spark bigdata hadoop hdp yarn does enabling cpu scheduling in yarn will really improve the parallel processing in spark yarn with capacity scheduler will take only memory into account when it is allocating resources for user requests if i submit a spark job like this  --master yarn --deploy-mode client --driver-memory 4g --executor-memory 4g --num-executors 1 --executor-cores 3  yarn will allocate an executor with  4gb memory and 1 vcpu  but when it is executing tasks it will execute 3 tasks parallelly  is it using that single core alone to execute all tasks as a set of 3 at a time?  so if i enable cpu scheduling and cgroups in hdp cluster will yarn assign 3 vcpu cores and will that set of 3 tasks will get executed in each cpu? will it really improve the processing time?  as for now i could not enable cpu scheduling in my cluster hdp 2.6.5 centos 7.5 due to the below error in starting node manager not able to enforce cpu weights cannot write to cgroup at /sys/fs/cgroup/cpu,cpuacct no vcores and vcpus are really a logical construct that are not related to what is actually on the system but more closely related to how many processes are running  the os linux in this case will migrate work to all cpus if the process is designed for this  most long running java applications will do this due to the multiple threads running  yarn doesn t control cpu cores unless you enable cgroups  the only thing yarn controls is the memory usage  the reason this doesn t matter is because typical hadoop workloads are i/o bound not cpu bound  references    using cgroups with yarn",15,0.9335550884970865,"0.033*""gpu"" + 0.030*""memory"" + 0.027*""run"" + 0.016*""time"" + 0.012*""cpu"" + 0.011*""machine"" + 0.010*""process"" + 0.009*""gb"" + 0.009*""size"" + 0.009*""datum"""
27327_kg,"hi   can anyone suggest some website or material to learn data science and sas if anyone has material for it can you share it  thanks,tarun   for machine learning &amp other related topics following sites could be a good way to start your journey   www.coursera.org various online courses   https://www.udemy.com  various online courses   https://www.youtube.com/playlist?list=pld63a284b7615313a&amp;spfreload=1  lectures on machine learning   wish you luck!   hello there - you can use hackerrank for practice - there are lots of categories that you may find useful however if you are looking for something to study then go for edx or coursera for data science courses- they are really useful   edx and udacity courses are great.covers both introductory and advanced topics!   in addition to what other have mentioned i would also recommend to take statistics class this youtube channel is great for statistics  https://www.youtube.com/channel/ucfrjdcimgcqvyfbk04mbeha",22,0.933362646771196,"0.033*""learn"" + 0.027*""datum"" + 0.024*""machine"" + 0.019*""learning"" + 0.015*""data"" + 0.014*""good"" + 0.013*""https"" + 0.013*""python"" + 0.011*""science"" + 0.010*""start"""
116794_kg,"       ```df_data = pd.read_csv /kaggle/input/2019-pr-midterm-musicclassification/data_train.csv   df_data.drop[filename] axis=1 inplace=true  label=df_data[label].copy # labeldf_data.drop[ label ],axis=1,inplace=true```pandas  csv  df_data .drop  filename     label label   df_data label   .    &amp validation 25%  ```split = stratifiedshufflesplitn_splits=10 test_size=0.25 random_state = 42  for train_index cross_index in split.splitdf_data label:    strat_train_set=df_data.iloc[train_index]    strat_cross_set = df_data.iloc[cross_index]    music_labels=label[train_index]  music = strat_train_set.copymusic = scalemusic;```stratifiedshufflesplit    75 .strat_train_set   music_labels  .scale  music         kernel rbf cost       poly          ```  load datasets  dataframe     df_data = pd.read_csv /kaggle/input/2019-pr-midterm-musicclassification/data_test.csv df_data.drop[filename] axis=1 inplace=true  x_test = df_data.droplabel axis=1y_test = df_data[label].copyx_test_prepared = scalex_test```   filename label          predict      csv    ```  numpy  pandas             id label     import pandas as pds = pd.seriesresultdata={ id :range1,51 label :s}printresult.shapedf = pd.dataframedatadf.index += 1 df = df.replace blues ,0df = df.replace classical ,1df = df.replace country ,2df = df.replace disco ,3df = df.replace hiphop ,4df = df.replace jazz ,5df = df.replace metal ,6df = df.replace pop ,7df = df.replace reggae ,8df = df.replace rock ,9df.to_csv results-yk-v2.csv ,index=true,index_label= id  header=true,columns=[label]```   result pandas      .     replace   ",19,0.9333587945352048,"0.044*""column"" + 0.044*""file"" + 0.032*""csv"" + 0.026*""row"" + 0.026*""datum"" + 0.017*""data"" + 0.013*""lt"" + 0.013*""_"" + 0.011*""read"" + 0.011*""table"""
51651240_so,cluster-analysis r doing clustering with some data points always clustered together is there some r functions to perform clustering hclust kmeans ect. on   data points   with the constraint that some points   are always clustered together? or equivalently is there some approach to perform clustering with given initial clusters found a solution if using hclust set the dist values within the same initial cluster as 0 so that the points within each initial cluster will always be clustered together if using the kmeans represent each initial cluster by a new point defined as the centroid of the cluster,23,0.93308521297178,"0.077*""cluster"" + 0.027*""point"" + 0.021*""distance"" + 0.020*""datum"" + 0.019*""matrix"" + 0.018*""algorithm"" + 0.013*""pca"" + 0.013*""analysis"" + 0.011*""number"" + 0.011*""vector"""
51226011_so,tensorflow tensorflow-serving tensorflow.js tensorflow frozen graph to savedmodel i ve been trying to use tensorflow.js but i need the model in the savedmodel format so far i only have the frozen graph as i used tensorflow for poets codelab  how can i convert the frozen graph into savedmodel?  i ve been using the latest python version and tensorflow 1.8 the savedmodel is really just a wrapper around a frozen graph that provides assets and the serving signature for a code implementation  see this answer,7,0.9330434330082397,"0.123*""tensorflow"" + 0.035*""model"" + 0.026*""tf"" + 0.026*""graph"" + 0.024*""python"" + 0.023*""variable"" + 0.015*""code"" + 0.014*""tensor"" + 0.014*""create"" + 0.013*""function"""
87227_kg,"hello all  good day to you i used to work as an information coordinator but i also have a beginner experience in python programming.i have now switch to data science and i like you support with tasks and freelance work anything you have to offer is important my most important question is how do i develop my skill on data science?   thank you all   this is awesome! i don t currently have tasks or freelance work but may i recommend you sign up for data camp? it is an amazing place to learn all about data science!   cognitiveclass.ai has a free intro to python in the data sciences which will give you a very quick and easy overview it s small but they have lots of other courses that are free as well so you can start diving more into it.i d also look at their ibm s professional data science certificate on coursera and their advanced data science specialization as well the courses include key concepts programming and even a project to get you started.coursera i really enjoy for just getting a bit more into these topics they are short enough cheap enough,and self-paced enough while giving you a certificate just so you have the record as you go through   this is great !!! anderw ng coursera machine learning course is the best choice for data science   i have the same purpose like you and looking for a good course to develop my skills.i am learning some course in edx which you can refer as well   hi oluwole  greetings..!!  data science is a vast field to stuy  in my humble opinion i would suggest you to implement every concept you read to ensure that you rememeber them and know how to implement them when required  i hope you enjoy learning  best regards,akash bhiwgade",22,0.932587329089865,"0.033*""learn"" + 0.027*""datum"" + 0.024*""machine"" + 0.019*""learning"" + 0.015*""data"" + 0.014*""good"" + 0.013*""https"" + 0.013*""python"" + 0.011*""science"" + 0.010*""start"""
145440_kg,hello! in any competition i can not create a new notebook or edit an old one it is loading and loading..... there is permanent indicator  draft session  starting restarting a session does not help any help ? thank you    could you provide any more details?javascript console / network tab showing errors with firestore or kkb-production?does using a different browser help? what browsers have you tried?are you on a vpn/proxy have antivirus / browser ext / adblocker that might interfere with the connection?reliable/reasonably fast internet connection?happening for all notebooks or specific ones/settings?   @dmitri9149     xpost.ts:179 uncaught in promise domexception failed to read the  localstorage  property from  window  access is denied for this document.    at s  https://www.kaggle.com/next/kernels/editor.js?v=1587602950:219:40313     at  https://www.kaggle.com/next/kernels/editor.js?v=1587602950:219:41485     at new promise     at  https://www.kaggle.com/next/kernels/editor.js?v=1587602950:219:41201     at  https://www.kaggle.com/next/kernels/editor.js?v=1587602950:391:167267     at  https://www.kaggle.com/next/kernels/editor.js?v=1587602950:219:78682     at object.next  https://www.kaggle.com/next/kernels/editor.js?v=1587602950:219:78787     at  https://www.kaggle.com/next/kernels/editor.js?v=1587602950:219:77724     at new promise     at l  https://www.kaggle.com/next/kernels/editor.js?v=1587602950:219:77498   this is the error message from chrome usually i always use the chrome browser as you advised i try firefox now and everything works fine with the firefox i can edit and create new notebooks  thank you    xpost.ts:179 uncaught in promise domexception failed to read the  localstorage  property from  window  access is denied for this document.    at s  https://www.kaggle.com/next/kernels/editor.js?v=1587602950:219:40313     at  https://www.kaggle.com/next/kernels/editor.js?v=1587602950:219:41485     at new promise     at  https://www.kaggle.com/next/kernels/editor.js?v=1587602950:219:41201     at window._events  https://www.kaggle.com/next/kernels/editor.js?v=1587602950:391:168394     at window._events.dispatch  https://kkb-production.jupyter-proxy.kaggle.net/k/32545019/eyjhbgcioijkaxiilcjlbmmioijbmti4q0jdluhtmju2iiwidhlwijoislduin0..n9zpafea0o5bxcu3lnytaq.fuil_odnqkcqegwjrnl-iknope4pnesmjh09ip7iv_hvqyfarjsihdymzpa-aromkcz5hdsih4lu80zq3xdorg.bzz9i7naym3q35btqutnuq/proxy/static/notebook/js/main.min.js?v=1b0256649fd5326c7cad4be834633ffd:3:7537     at window._events.r.handle  https://kkb-production.jupyter-proxy.kaggle.net/k/32545019/eyjhbgcioijkaxiilcjlbmmioijbmti4q0jdluhtmju2iiwidhlwijoislduin0..n9zpafea0o5bxcu3lnytaq.fuil_odnqkcqegwjrnl-iknope4pnesmjh09ip7iv_hvqyfarjsihdymzpa-aromkcz5hdsih4lu80zq3xdorg.bzz9i7naym3q35btqutnuq/proxy/static/notebook/js/main.min.js?v=1b0256649fd5326c7cad4be834633ffd:3:5620     at trigger  https://kkb-production.jupyter-proxy.kaggle.net/k/32545019/eyjhbgcioijkaxiilcjlbmmioijbmti4q0jdluhtmju2iiwidhlwijoislduin0..n9zpafea0o5bxcu3lnytaq.fuil_odnqkcqegwjrnl-iknope4pnesmjh09ip7iv_hvqyfarjsihdymzpa-aromkcz5hdsih4lu80zq3xdorg.bzz9i7naym3q35btqutnuq/proxy/static/notebook/js/main.min.js?v=1b0256649fd5326c7cad4be834633ffd:4:4818     at object.trigger  https://www.kaggle.com/next/kernels/editor.js?v=1587602950:391:163616     at window._events  https://kkb-production.jupyter-proxy.kaggle.net/k/32545019/eyjhbgcioijkaxiilcjlbmmioijbmti4q0jdluhtmju2iiwidhlwijoislduin0..n9zpafea0o5bxcu3lnytaq.fuil_odnqkcqegwjrnl-iknope4pnesmjh09ip7iv_hvqyfarjsihdymzpa-aromkcz5hdsih4lu80zq3xdorg.bzz9i7naym3q35btqutnuq/proxy/static/notebook/js/main.min.js?v=1b0256649fd5326c7cad4be834633ffd:4:5328    usually i use chrome as you advise i try ferifox now and all is working fine in the firefox i can edit and create new notebooks thank you    one more message from devtools  devtools failed to load sourcemap could not load content for  https://www.kaggle.com/service-worker.js.map  http error status code 404 net::err_http_response_code_failure   thanks  @dmitri9149  ! i ll investigate what s going on with chrome it may very well be connected with localstorage being disabled as you mentioned   thank you all is working fine    awesome your report helped me deploy the fix for this issue,4,0.9325220626549232,"0.040*""kaggle"" + 0.040*""kernel"" + 0.038*""https"" + 0.036*""dataset"" + 0.025*""file"" + 0.021*""notebook"" + 0.020*""www"" + 0.017*""download"" + 0.011*""link"" + 0.010*""github"""
90418_kg,hi all emails will be sent today to all the winners with instructions on how to redeem prizes i truly apologize for the delay with this competition s winner announcements  i know many people have worked hard   winner emails have been sent out! if you did not receive one and should ve please email me directly at mark@kaggle.com i may be a bit slow to respond but will get back to all inquiries regarding this competition thank you   thanks mark i got the emails   thank you mark !! i have received the email regarding top100 prize just wanted to confirm if the fun prizes are also selected if yes it would be great if you could share the winners list thank you :   hi  has kaggle chosen and sent emails to the winners of the top 5 creative team names competition and the other special prizes as well?  nan  hi mark was the top 5 team name prize available? if so please publish the winner list thanks,17,0.9320199138748594,"0.055*""competition"" + 0.034*""submission"" + 0.026*""kaggle"" + 0.025*""team"" + 0.014*""submit"" + 0.014*""score"" + 0.011*""leaderboard"" + 0.011*""make"" + 0.009*""rule"" + 0.009*""stage"""
101746_kg,hello  i have two datasets and one utility kernel added to my kernel s workspace and its status doesn t change from loading... killing kernel s session restarting it and changing the version of docker have not been helpful  any help would be appreciated!       @amiralisa  we were experiencing site issues at the time but this should now be resolved are you still experiencing this issue? if so please reply back with the kernel url    @ian  yes i m still experiencing the same issue the kernel is private so please let me know how can i share the url    @amiralisa  can you disable all of your browser extensions and try to access your account again? i m wondering if one of them is preventing your kernel from connecting    @ian  i can connect to my kernel but the workspace list on the right side is constantly loading which does not allow me to add or remove datasets!     @amiralisa  what browser are you using? what is the url of your kernel? can you try to log into your account in incognito or private mode then tell us what happens when you try accessing the kernel again here?    @ian  i also have faced the same issue tried different browsers incognito mode no difference my url  https://www.kaggle.com/soheilsadeghii/maskrcnn-v01/edit/run/18239896  can you please help me with that?    @ian  browser chrome v75kernel url  link   i removed all local session and cache storages on my browsers i also checked the kernel in incognito mode but it didn t get fixed! seems the issue isn t caused by cookies!     @soheilsadeghii  you can download your notebook then create a new kernel and upload the downloaded notebook on it  please notice that you might lose the previous versions of your codings,4,0.9318550618546294,"0.040*""kaggle"" + 0.040*""kernel"" + 0.038*""https"" + 0.036*""dataset"" + 0.025*""file"" + 0.021*""notebook"" + 0.020*""www"" + 0.017*""download"" + 0.011*""link"" + 0.010*""github"""
38461816_so,serialization tensorflow example to save and load a sub graph in tensorflow i created a model within a variable/name scope and would like to store its graph definition and variables to disk to later load it without defining the graph again how can i save and load all operations and variables within a given variable/name scope?  conveniently i would like to just use     its   has an option to store the meta graph but   does not seem to import it moreover in the saver constructor i can specify a list of parameters but not a name scope to control what operations are saved  there is also     but i couldn t find an explanation of what it is and how it relates to the saver class and meta graph ,7,0.9317206220401157,"0.123*""tensorflow"" + 0.035*""model"" + 0.026*""tf"" + 0.026*""graph"" + 0.024*""python"" + 0.023*""variable"" + 0.015*""code"" + 0.014*""tensor"" + 0.014*""create"" + 0.013*""function"""
101693_kg,hello everyone!  please help me to understand which of the following is correct and why  i  1 x_train x_test  split the training set into training and test sets2 x_train_std      standardize x_train3 x_train_res      oversample x_train_std4 model.fit        train the model using x_train_res5 x_test_std       standardize x_test using the parameters calculated in 26 model.evaluate   evaluate the model using x_test_std  ii  1 x_train x_test  split the training set into training and test sets2 x_train_std      standardize x_train3 x_train_res      oversample x_train_std4 x_train_res_std  standardize x_train_res5 model.fit        train the model using x_train_res_std6 x_test_std       standardize x_test using the parameters calculated in 47 model.evaluate   evaluate the model using x_test_std  thanks in advance,1,0.9313122389823513,"0.087*""datum"" + 0.067*""set"" + 0.061*""test"" + 0.057*""training"" + 0.054*""train"" + 0.050*""model"" + 0.036*""dataset"" + 0.021*""data"" + 0.016*""sample"" + 0.016*""prediction"""
35675816_so,c++ character detection opencv extracting part of an image outlined with a red box with opencv c+ i have the following image  example image     i need to recognize the character within it to do this i want to produce a mask to remove everything but the red box  what is the best method i could use to do this?   currently i use a hsv filter to produce a mask and use the mask to crop the image to just the red square   this produces a poor mask as it has the t itself excluded depending on how i view the image i need a more robust approach   -i was wondering if there is a way to make a box around the significant white region and use the box as my mask instead however i m not sure on how to implement that on opencv  with the mask i apply a canny edge detection then i find the contours and fill the contours   my results  contour output and mask   the result i get isn t robust enough i ideally need to be able to detect a large sign on a grass field from an aerial video feed so it needs to work with the red square with different sizes  is there any way in which i can improve this process in general?  the character recognition method hasn t been decided yet if you just want to recognize the character    convert image to gray scale  since the character is white and rest of image is colored the character in the gray image will still be white so take a threshold and suppress all non white pixels  run your classifier to recognize the character    if you want to extract the red box    locate the red pixels then crop image,20,0.9303615467270362,"0.132*""image"" + 0.019*""opencv"" + 0.014*""pixel"" + 0.013*""object"" + 0.012*""detect"" + 0.010*""detection"" + 0.010*""find"" + 0.010*""face"" + 0.009*""video"" + 0.008*""feature"""
