key,Message,topic,val,words
13882191_so,opencv titanium xcode4.5 trouble getting opencv framework symbols to link in xcode i m missing something minor here in my project using the opencv framework from a working demo  steps to reproduce    download the example app from  http://aptogo.co.uk/2011/09/opencv-framework-for-ios/     create a new titainum ios module with titanium create --platform=iphone --type=module --dir= --name=opencv --id=opencv    open the xcode project drag in the opencv framework from the facetracker app and the other required frameworks    add other_ldflags=$inherited -framework opencv to module.xcconfig    create new tiuiview and tiuiviewproxy classes named opencvview and opencvviewproxy    in the new opencvview class instantiate a uiviewcontroller that uses opencv    the build will build the titanium module but when i try to run the module test harness i get these errors for opencv objects  undefined symbols for architecture i386:  _cmsamplebuffergetimagebuffer referenced from:      -[videocaptureviewcontroller captureoutput:didoutputsamplebuffer:fromconnection:] in libopencv.avideocaptureviewcontroller.o  _cmsamplebuffergetoutputpresentationtimestamp referenced from:      -[videocaptureviewcontroller captureoutput:didoutputsamplebuffer:fromconnection:] in libopencv.avideocaptureviewcontroller.o  _cmtimemake referenced from:      -[videocaptureviewcontroller createcapturesessionforcamera:qualitypreset:grayscale:] in libopencv.avideocaptureviewcontroller.o  _cvpixelbuffergetbaseaddress referenced from:      -[videocaptureviewcontroller captureoutput:didoutputsamplebuffer:fromconnection:] in libopencv.avideocaptureviewcontroller.o  _cvpixelbuffergetbaseaddressofplane referenced from:      -[videocaptureviewcontroller captureoutput:didoutputsamplebuffer:fromconnection:] in libopencv.avideocaptureviewcontroller.o  _cvpixelbuffergetheight referenced from:      -[videocaptureviewcontroller captureoutput:didoutputsamplebuffer:fromconnection:] in libopencv.avideocaptureviewcontroller.o  _cvpixelbuffergetpixelformattype referenced from:      -[videocaptureviewcontroller captureoutput:didoutputsamplebuffer:fromconnection:] in libopencv.avideocaptureviewcontroller.o  _cvpixelbuffergetwidth referenced from:      -[videocaptureviewcontroller captureoutput:didoutputsamplebuffer:fromconnection:] in libopencv.avideocaptureviewcontroller.o  _cvpixelbufferlockbaseaddress referenced from:      -[videocaptureviewcontroller captureoutput:didoutputsamplebuffer:fromconnection:] in libopencv.avideocaptureviewcontroller.o  _cvpixelbufferunlockbaseaddress referenced from:      -[videocaptureviewcontroller captureoutput:didoutputsamplebuffer:fromconnection:] in libopencv.avideocaptureviewcontroller.o  cv::_inputarray::_inputarraycv::mat const&amp; referenced from:      -[demovideocaptureviewcontroller processframe:videorect:videoorientation:] in libopencv.ademovideocaptureviewcontroller.o  cv::_outputarray::_outputarraycv::mat&amp; referenced from:      -[demovideocaptureviewcontroller processframe:videorect:videoorientation:] in libopencv.ademovideocaptureviewcontroller.o  cv::cascadeclassifier::loadstd::string const&amp; referenced from:      -[demovideocaptureviewcontroller viewdidload] in libopencv.ademovideocaptureviewcontroller.o  cv::cascadeclassifier::cascadeclassifier referenced from:      -[demovideocaptureviewcontroller .cxx_construct] in libopencv.ademovideocaptureviewcontroller.o  cv::cascadeclassifier::~cascadeclassifier referenced from:      -[demovideocaptureviewcontroller .cxx_destruct] in libopencv.ademovideocaptureviewcontroller.o  cv::mat::deallocate referenced from:      -[videocaptureviewcontroller captureoutput:didoutputsamplebuffer:fromconnection:] in libopencv.avideocaptureviewcontroller.o      -[uiimageuiimage_opencv cvmat] in libopencv.auiimage+opencv.o      -[uiimageuiimage_opencv cvgrayscalemat] in libopencv.auiimage+opencv.o  cv::mat::createint int const* int referenced from:      -[uiimageuiimage_opencv cvmat] in libopencv.auiimage+opencv.o      -[uiimageuiimage_opencv cvgrayscalemat] in libopencv.auiimage+opencv.o  cv::flipcv::_inputarray const&amp cv::_outputarray const&amp int referenced from:      -[demovideocaptureviewcontroller processframe:videorect:videoorientation:] in libopencv.ademovideocaptureviewcontroller.o  cv::resizecv::_inputarray const&amp cv: outputarray const&amp cv::size  double double int referenced from:      -[demovideocaptureviewcontroller processframe:videorect:videoorientation:] in libopencv.ademovideocaptureviewcontroller.o  cv::fastfreevoid* referenced from:      -[videocaptureviewcontroller captureoutput:didoutputsamplebuffer:fromconnection:] in libopencv.avideocaptureviewcontroller.o      -[uiimageuiimage_opencv cvmat] in libopencv.auiimage+opencv.o      -[uiimageuiimage_opencv cvgrayscalemat] in libopencv.auiimage+opencv.o  cv::transposecv::_inputarray const&amp cv::_outputarray const&amp; referenced from:      -[demovideocaptureviewcontroller processframe:videorect:videoorientation:] in libopencv.ademovideocaptureviewcontroller.o  _kcvpixelbufferpixelformattypekey referenced from:      -[videocaptureviewcontroller createcapturesessionforcamera:qualitypreset:grayscale:] in libopencv.avideocaptureviewcontroller.old symbols not found for architecture i386clang error linker command failed with exit code 1 use -v to see invocation i have similar errors and just changing build setting does not help  finally i solved this problem by adding some framework like coremedia corevideo etc.these frameworks however are not used in my code  so i guess opencv needs these frameworks but i don t know why  hope this will help:  i had a similar problem with the default apple llvm compiler on xcode 4.5.1 try changing it to gcc from your build options and see if this works,21,0.902662940903043,"0.060*""file"" + 0.032*""opencv"" + 0.026*""caffe"" + 0.017*""java"" + 0.016*""library"" + 0.014*""build"" + 0.012*""android"" + 0.009*""project"" + 0.009*""convert"" + 0.009*""find"""
135323_kg,hi can anyone please help in unzip file for emenddings.zip file i did just unzip files but it shows like flating google.text file.please help me out from this issue check out here   kernel link        neuro_stupid wrote       hi can anyone please help in unzip file for emenddings.zip file i did just unzip files but it shows like flating google.text file.  please help me out from this issue check out here   kernel link,4,0.90253743993754,"0.040*""kaggle"" + 0.040*""kernel"" + 0.038*""https"" + 0.036*""dataset"" + 0.025*""file"" + 0.021*""notebook"" + 0.020*""www"" + 0.017*""download"" + 0.011*""link"" + 0.010*""github"""
91278_kg,i was trying to find the .csv dataset to download however i can only see the .json files can someone tell me if the .csv dataset is still available?    https://www.kaggle.com/yelp-dataset/yelp-dataset/version/6    there isn t a clear download button like on the main dataset page  goto  https://www.kaggle.com/yelp-dataset/yelp-dataset/version/6   click on yelp_review.csv under data sources then just below the .csv file list over to the right there is a grey download arrow the first of three little icons,4,0.9022793053870604,"0.040*""kaggle"" + 0.040*""kernel"" + 0.038*""https"" + 0.036*""dataset"" + 0.025*""file"" + 0.021*""notebook"" + 0.020*""www"" + 0.017*""download"" + 0.011*""link"" + 0.010*""github"""
22336463_so,"matlab statistics how do i use the silhouette function in matlab i have a question on how to use silhouette function in matlab  if i have my correlation matrix x =  90x90 and my cluster membership numbers for my data say i have five clusters this is defined as cidx which is length 90x1 each value is assigned a number from 1 to 5  can i just pass the correlation matrix and cidx to the silhouette function and specify the measure as  correlation  or should i be passing in my returns matrix instead?  thanks for your help first of all you need to make your clusters for example  kmeans  function in matlab does this for you   according to matlab       idx = kmeansx,k  partitions the points in the  n-by-p  data matrix  x   into  k  clusters this iterative partitioning minimizes the sum over  all clusters of the within-cluster sums of point-to-cluster-centroid  distances rows of  x  correspond to points columns correspond to  variables  kmeans  returns an  n-by-1  vector  idx  containing the cluster  indices of each point   so here  cidx  is the  n-by-1  cluster indices.after finding the indices you can pass the  x  and the  cidx  to the  silhouette  function    s  is the silhouette values in the n-by-1 vector  silhouette is used to determine the quality of clustering the way this function works is illustrated below using a matrix of 100*3 size.example ",23,0.9021953598584264,"0.077*""cluster"" + 0.027*""point"" + 0.021*""distance"" + 0.020*""datum"" + 0.019*""matrix"" + 0.018*""algorithm"" + 0.013*""pca"" + 0.013*""analysis"" + 0.011*""number"" + 0.011*""vector"""
55146700_so,deep-learning python tensorflow tf.get_collectiontf.graphkeys.global_variables of loaded .pb file is empy i m trying to look at variable list of loaded   file but for some reason it s empty  here is the code   also why is in v2 case i get    the     object serialized to the   file does not contain collections information if you want to store a graph along with its metadata including the collections you should save a     instead see     /      in your   code   is   because     does not return anything it just imports the nodes in the given graph definition into the current default graph  as a side comment note that  graph collections are being deprecated in tensorflow 2.x,7,0.9021665298405642,"0.123*""tensorflow"" + 0.035*""model"" + 0.026*""tf"" + 0.026*""graph"" + 0.024*""python"" + 0.023*""variable"" + 0.015*""code"" + 0.014*""tensor"" + 0.014*""create"" + 0.013*""function"""
145319_kg,thanks for sharing this notebook!  i wanted to reach out and suggest that you save your notebook using the save and run all button instead of the quick save button  you should only click on quick save if you have already run your notebook from top to bottom or else your notebook will look blank if you have not already run your notebook from top to bottom then you will want to click on save and run all instead  you can read about the difference between quick save and save and run all here  https://www.kaggle.com/product-feedback/139884       and don t forget to make all of your data source public  thanks again for sharing this notebook,4,0.9017146107312701,"0.040*""kaggle"" + 0.040*""kernel"" + 0.038*""https"" + 0.036*""dataset"" + 0.025*""file"" + 0.021*""notebook"" + 0.020*""www"" + 0.017*""download"" + 0.011*""link"" + 0.010*""github"""
11093735_so,cluster-analysis hierarchical-clustering hierarchical-data python how to select closest representative to the center in each cluster in scipy-cluster so basically i use the python module  scipy-cluster  to plot a lot of data points is there are way/function that give the representative of each cluster if given the threshold or the number of representatives i want? ideally each representative must has the closest distance to the center of the cluster it belongs to    edit i m looking for the data point closest to the centroid in each cluster i don t really know my way around scipy-cluster but it sounds like it gives you the centroid coordinates given that information and the knowledge of which points are in the cluster it should be trivial to calculate the distance from the centroid for each point in the cluster just make sure your calculation is based on the same distance metric you used for clustering probably euclidean distance  scipy-cluster provides coordinates for each centroid and identifies which points are in each cluster once you have that i believe     will give you the distance between observations and centroids,23,0.9014176873637992,"0.077*""cluster"" + 0.027*""point"" + 0.021*""distance"" + 0.020*""datum"" + 0.019*""matrix"" + 0.018*""algorithm"" + 0.013*""pca"" + 0.013*""analysis"" + 0.011*""number"" + 0.011*""vector"""
14423854_so,c eye-detection opencv detect eye using hsv value in open cv i want to detect an eye i have some code where i can detect blue color object so if i made changeshow i can? then it would be possible for me to detect an eye as the below color has its own specific  range value so if i specify the eye color hsv value then can i detect eye with this method  in this below code i am going to detect blue color object please tell me that where i do changes in my code so that i could get eye using open cv such a simple method may work at extracting a blue object using some thresholding but even if it could be adapted using a different colour black? blue? green? everyone has different eye colours i don t see a non hacky method working for you using blob extraction like this based on a hsv threshold value this method works well on large blocks of the same colour i.e removing a blue background  look more at shape everyone has different coloured eyes but the shape is circular/ellipse ish there are varients of the  hough transform  for detecting circles     ...the hough transform has been extended to identifying positions of  arbitrary shapes most commonly circles or ellipses   eye detection is much easier with haar classifier. link here,20,0.9013150763773033,"0.132*""image"" + 0.019*""opencv"" + 0.014*""pixel"" + 0.013*""object"" + 0.012*""detect"" + 0.010*""detection"" + 0.010*""find"" + 0.010*""face"" + 0.009*""video"" + 0.008*""feature"""
39244421_so,object-detection opencv how to detect and recognize a specific object in an image i want to detect or recognize a specific object in an image  first of all  say what i have done i tried to detect a logo  e.g  google logo i have the original image of the logo but in the images which i am going to process are taken with different cameras from different angle and from different distance and from different screens wide screen like cinema   i am using opencv 3 to check whether this logo is in these images i have tried the opencv surf sift etc functions and also tried norm_l2 algorithm which compares two images and template matching and also used svm it was so slow and not correct detection and some other opencv functions  but  no one was good to use  then  i did my own algorithm which is working better than the above functions but also cannot satisfy the requirements   now  my question is is there any better way to detect the specific object in an image? for example what should i do at the first and second.. steps ,20,0.9007365309208991,"0.132*""image"" + 0.019*""opencv"" + 0.014*""pixel"" + 0.013*""object"" + 0.012*""detect"" + 0.010*""detection"" + 0.010*""find"" + 0.010*""face"" + 0.009*""video"" + 0.008*""feature"""
11272264_so,bigdata hadoop hdfs java mapreduce which machine does the reducer of the hadoop run on if i have a 4 node cluster where 1 machine is the namenode and the remaining 3 machines are datanodes and if i set the number of reducers to 1 which of the data nodes will run the reducer the namenode and datanode are hdfs processes not mapreduce i assume you have 3 task tracker nodes one of them will run it there is no guarantee which one hadoop generally moves computation to be near the data that it needs but for reducers they are pulling data from mappers not hdfs you can say hadoop will prefer a less loaded node with at least one reduce slot,15,0.9006786294247832,"0.033*""gpu"" + 0.030*""memory"" + 0.027*""run"" + 0.016*""time"" + 0.012*""cpu"" + 0.011*""machine"" + 0.010*""process"" + 0.009*""gb"" + 0.009*""size"" + 0.009*""datum"""
55562078_so,tensorflow2.0 tensorflow 2.0  frozen graph support will the support for frozen graph continue in tensorflow 2.0 or deprecated?i mean the scripts and apis to create/optimize frozen graph from saved_model also the apis to run the inference for the same   assuming it will be supported in future what is the recommended method to run the inference on frozen graph in tensorflow 2.0  the freeze graph apis -     and     - will not be supported in tensorflow 2.0  in 2.0 the primary export format is  savedmodels  so apis are built to directly support savedmodels. inference on existing frozen graphs can be run using the   path,7,0.9006753675238465,"0.123*""tensorflow"" + 0.035*""model"" + 0.026*""tf"" + 0.026*""graph"" + 0.024*""python"" + 0.023*""variable"" + 0.015*""code"" + 0.014*""tensor"" + 0.014*""create"" + 0.013*""function"""
78233_kg,"since i only do this competition 5 days ago and i have 5 fold cv 3.648 ~ 3.646i shuffle the random seed and the lb score is 3.688i only submit twice so i have no idea how random seed influences the lb score.  but when i see this discussion  https://www.kaggle.com/c/elo-merchant-category-recommendation/discussion/73517  i see many kagglers  cv are similar to me    so i am a little confused about how much  can you gain  with post processing would you like to share your corresponding cv&amp;lb score before and after post-processing?   hi longyin  i would not say post processing but i did some ensemble and stacking that gave me boost of  .003 over my best single model   https://www.kaggle.com/c/elo-merchant-category-recommendation/discussion/77849    i try post processing https://www.kaggle.com/waitingli/combining-your-model-with-a-model-without-outlier  with my best single model but score   cv  3.652   before post-processing cv 3.655 lb 3.689  after post processing lb 3.685   thanks for sharing   thanks for sharing i will try that next time   thanks for sharing   actually post processing should get 4-6/1000 points imp   seems i should do more ensemble and stacking   may i ask what do you mean shuffle the random seed ?   i did different post processing approach   but i think that it is overfitting in the lb :d   like the example below     from sklearn.model_selection import stratifiedkfold,kfold  kf = kfoldn_splits=5,shuffle=true,random_state=1        @manoj -how many different model did u use?   got it   hi subikash,i have used 8 models all of them are lightgbm so far   thanks manoj all these are having different features ?   lb 3.695 cv  3.65498 -&gt 3.690   btw i tried to use the merchants.csv but it leads to bad results does anybody know how to use it?   top 80-90 features are common rest i am choosing and dropping randomly i still experimenting i have not yet build a proper pipeline    https://www.kaggle.com/c/elo-merchant-category-recommendation/discussion/77987#458060    you mean you can get nearly 3.658 without post processing this is amazing   yesstacking really helps   single model lgb = lb 3.681 cv  3.6688 after post processing = lb 3.673   single lgb means one lgb model  or 5-fold lgb?   5 fold lgb   thanks   your cv score is impressive i think it shows a low risk of overfitting    for  outlier post-processing would anyone share that how you decide the threshold? 2207/201917?   sadly i got a huge gap between cv and lb.cv 3.64882 lb 3.693   this is reasonable now my cv is 3.6395 and lb is 3.679 the rest is from the kernel part by combining with binary classification   sadly i got a better  cv is 3.648 but lb is 3.687best lb is 3.683 and cv is3.6504i don t know how to deal with it   thanks for sharing   @longyin hi longyin! may u willing to have a talk with u ,then consider if team up with us    thanks for your kind invitation  i have formed a team  i am looking forward to having opportunities for future cooperation   okay thanks haha   both you guys are excellent!   without post processing.single model 9 fold cv score 3.648 lb score 3.680.break up of above score based on outliersscore only for non-outlier targets 1.826 score only for outlier targets 30.261",14,0.9004533928757951,"0.041*""score"" + 0.032*""lb"" + 0.031*""model"" + 0.021*""cv"" + 0.018*""good"" + 0.016*""feature"" + 0.015*""public"" + 0.013*""competition"" + 0.012*""share"" + 0.012*""fold"""
39590729_so,bigdata hadoop hortonworks-data-platform raid hdp cluster with raid what is your experience with raid1 on hdp cluster?  i have in my mind two options   setup raid 1 for master and zoo nodes and don t use raid at all on slave nodes like kafka brokers hbase regionservers and yarn nodemanager s   even if i loose one slave node i will have two other replicas.in my opinion raid will only slow down my cluster   despite everything setup everything using raid 1   what do you think about it? what is you experience with hdp and raid?what do you think about using raid 0 for slave nodes i d recommend no raid at all on hadoop hosts there is one caveat in that if you are running services like oozie and the hive metastore that use a relational db behind the scenes raid may well make sense on the db host  on a master node assuming you have namenode zookeeper etc - generally the redundancy is built into the service for namenodes all the data is stored on both namenodes for zookeeper if you lose one node then the other two nodes have all the information  zookeeper likes fast disks - ideally dedicate a full disk to zookeeper if you have namenode ha give the namenode edits directory and each journal node a dedicated disk too  for the slave nodes the datanode will write across all disks effectively striping the data anyway each  write  is at most the hdfs block size so if you were writing a large file you could get 128mb on disk 1 then the next 128mb on disk 2 etc,15,0.9004118280811816,"0.033*""gpu"" + 0.030*""memory"" + 0.027*""run"" + 0.016*""time"" + 0.012*""cpu"" + 0.011*""machine"" + 0.010*""process"" + 0.009*""gb"" + 0.009*""size"" + 0.009*""datum"""
143003_kg,my notebook uses a datasource hosted on kaggle  https://www.kaggle.com/benhamner/jhucovid19   this dataset is updated on a daily basis  currently when i open my notebook i see in the datasource pane below the name of the dataset last updated 9 days ago version 30 of 48   what do i do to use a newer version of this dataset in my notebook,4,0.9001448581939898,"0.040*""kaggle"" + 0.040*""kernel"" + 0.038*""https"" + 0.036*""dataset"" + 0.025*""file"" + 0.021*""notebook"" + 0.020*""www"" + 0.017*""download"" + 0.011*""link"" + 0.010*""github"""
46086401_so,cluster-analysis hierarchical-clustering matplotlib python scipy how to plot with label from scipy.cluster.hierarchy.linkage how can i plot a bunch of 2-d points x say using matplotlib with color labels from scipy.cluster.hierarchy.linkagex method=single say k = 3 fcluster from scipy.cluster.hierarchy will do,23,0.9000955410849452,"0.077*""cluster"" + 0.027*""point"" + 0.021*""distance"" + 0.020*""datum"" + 0.019*""matrix"" + 0.018*""algorithm"" + 0.013*""pca"" + 0.013*""analysis"" + 0.011*""number"" + 0.011*""vector"""
58613825_so,computer-vision image image-processing opencv python get boundary from canny edges and remove the background of an image i m trying to remove the background of an image that im trying to train a neural network with i ve had little luck using the method described here  how do i remove the background from this kind of image?  but i have been able to use the canny edge detector to get a semi-good boundary of the object in my image heres my code i m running    and the resulting images we get are        so what i m looking for exactly is a way for me to get the boundaries of the canny edges and then from there crop the original image around these boundaries thanks if i understand correctly you want to remove the background and extract the object instead of using canny here s an alternative approach since you didn t provide an original image i screenshotted your image to use as input in general there are several ways to obtain a binary image for boundary extraction they include regular thresholding otsu s thresholding adaptive thresholding and canny edge detection in this case otsu s is probably the best since there is background noise      first we convert the image to grayscale then perform otsu s threshold to obtain a binary image     there are unwanted sections so to remove them we perform a morph open to separate the joints     now that the joints are separated we find contours and filter using contour area we extract the largest contour which represents the desired object then draw this contour onto a mask     we re almost there but there are imperfections so we morph close to fill the holes     next we bitwise-and with the original image     finally to get the desired result we color in all black pixels on the mask to white     from here you could use numpy slicing to extract the roi but i m not completely sure what you were trying to do i ll leave that up to you,20,0.9000852377746559,"0.132*""image"" + 0.019*""opencv"" + 0.014*""pixel"" + 0.013*""object"" + 0.012*""detect"" + 0.010*""detection"" + 0.010*""find"" + 0.010*""face"" + 0.009*""video"" + 0.008*""feature"""
145112_kg,thanks for sharing this notebook!  i wanted to reach out and suggest that you save your notebook using the save and run all button instead of the quick save button  you should only click on quick save if you have already run your notebook from top to bottom or else your notebook will look blank if you have not already run your notebook from top to bottom then you will want to click on save and run all instead  you can read about the difference between quick save and save and run all here  https://www.kaggle.com/product-feedback/139884       and don t forget to make your datasets public!  thanks again for sharing this notebook,4,0.8995975470607429,"0.040*""kaggle"" + 0.040*""kernel"" + 0.038*""https"" + 0.036*""dataset"" + 0.025*""file"" + 0.021*""notebook"" + 0.020*""www"" + 0.017*""download"" + 0.011*""link"" + 0.010*""github"""
